{
  "schemaVersion": 1,
  "direction": "pm",
  "title": "Основы управления проектом",
  "goal": "Составить план небольшого проекта: цель, задачи, сроки и риски, и скорректировать его при изменении условий",
  "modules": [
    {
      "id": "m-goal",
      "title": "Цель и результат проекта",
      "pages": [
        {
          "id": "p-goal",
          "title": "Что такое цель проекта",
          "blocks": [
            { "id": "b-goal-intro", "type": "markdown", "markdown": "Цель проекта описывает **результат**, а не действия. Хорошая цель отвечает на вопрос «что изменится, когда проект закончится»." },
            {
              "id": "q-goal-single",
              "type": "single_choice",
              "prompt": "Какая формулировка описывает результат, а не действие?",
              "options": [
                { "id": "a", "text": "Провести встречи с клиентами" },
                { "id": "b", "text": "К 1 марта клиенты оформляют заказ онлайн за 3 минуты" },
                { "id": "c", "text": "Начать разработку сайта" }
              ]
            },
            { "id": "b-goal-more", "type": "markdown", "markdown": "Результат должен быть проверяемым: по нему можно сказать, достигнута цель или нет." }
          ]
        },
        {
          "id": "p-risks",
          "title": "Риски",
          "blocks": [
            { "id": "b-risks-intro", "type": "markdown", "markdown": "Риск — событие, которое может случиться и повлиять на сроки, бюджет или результат." },
            {
              "id": "q-risks-multi",
              "type": "multiple_choice",
              "prompt": "Что из перечисленного относится к рискам проекта?",
              "options": [
                { "id": "a", "text": "Ключевой разработчик может заболеть" },
                { "id": "b", "text": "Поставщик может задержать оборудование" },
                { "id": "c", "text": "Команда ежедневно проводит планёрку" }
              ]
            },
            { "id": "q-risks-short", "type": "short_answer", "prompt": "Своими словами: зачем заранее составлять список рисков?" }
          ]
        }
      ]
    }
  ],
  "practice": [
    {
      "id": "t-plan-case",
      "title": "План переезда офиса",
      "kind": "case",
      "statement": "Компания из 20 человек переезжает в новый офис через 6 недель. Опишите цель проекта, 5–8 задач с последовательностью и сроками и три главных риска с мерами реагирования.",
      "relatedPages": ["p-goal", "p-risks"]
    }
  ],
  "exam": {
    "variants": [
      {
        "id": "exam-a",
        "title": "Вариант 1",
        "parts": [
          {
            "id": "exam-a-quiz",
            "title": "Тестирование знаний",
            "kind": "quiz",
            "questions": [
              {
                "id": "exam-a-q1",
                "type": "single_choice",
                "prompt": "Что отличает цель проекта от списка задач?",
                "options": [
                  { "id": "a", "text": "Цель описывает результат" },
                  { "id": "b", "text": "Цель длиннее" }
                ]
              }
            ]
          },
          {
            "id": "exam-a-case",
            "title": "Кейс с изменением условий",
            "kind": "case",
            "statement": "Составьте план запуска онлайн-курса за 8 недель. Затем бюджет сократили на треть: скорректируйте план и объясните выбор."
          }
        ]
      },
      {
        "id": "exam-b",
        "title": "Вариант 2",
        "parts": [
          {
            "id": "exam-b-quiz",
            "title": "Тестирование знаний",
            "kind": "quiz",
            "questions": [
              { "id": "exam-b-q1", "type": "short_answer", "prompt": "Чем риск отличается от проблемы?" }
            ]
          },
          {
            "id": "exam-b-case",
            "title": "Кейс с изменением условий",
            "kind": "case",
            "statement": "Составьте план открытия кофейни за 10 недель. Затем срок сдвинули на 3 недели раньше: скорректируйте план и объясните выбор."
          }
        ]
      }
    ]
  }
}
